Company,Brand,News,Date,SourceName,SourceURL
Marriott,N/A,"""Our portfolio is well positioned to benefit from continued expected strength at the upper end as higher-end consumers remain resilient and continue to prioritize spending on experience and travel over goods.""",Feb 2026,Marriott Q4 & FY 2025 Earnings Call,https://marriott.gcs-web.com/news-releases/news-release-details/marriott-international-reports-fourth-quarter-and-full-year-2025
Hilton,N/A,"""Within luxury, we continued to build strong momentum after the Waldorf Astoria New York opening, and in the Fourth Quarter, we opened our second Waldorf Astoria in Shanghai and celebrated the brand's debut in Helsinki.""",Feb 2026,Hilton Q4 & FY 2025 Earnings Release,https://stories.hilton.com/releases/hilton-reports-2025-fourth-quarter-and-full-year-results
Hyatt,N/A,"""Leisure transient RevPAR increased about 6% year over year, including 9% growth across luxury brands.""",Feb 2026,Hyatt Q4 & FY 2025 Earnings Release,https://newsroom.hyatt.com/Q4-FullYear-2025-Earnings
IHG,N/A,"""Altogether we delivered another excellent set of results, demonstrating the strength and resilience of our business model and the power of our growth algorithm, despite some turbulent trading conditions. RevPAR growth, system growth, and margin expansion collectively drove a 13 percent increase in EBIT.""",Feb 2026,IHG FY 2025 Full Year Results,https://www.ihgplc.com/en/investors/results-reports-and-presentations/2026/full-year-results-for-the-year-to-31-dec-2025
Accor,N/A,"""Once again the Accor Group delivered solid performance in 2025, in line with its medium-term objectives. This consistent year-on-year improvement in results confirms the strength of the Group's business model, the attractiveness of its brands, the relevance of its geographic positioning, and the commitment of its teams.""",Feb 2026,Accor FY 2025 Full Year Results,https://group.accor.com/en/finance/financial-results
